{
  "contractVersion": "1.0.0",
  "kind": "canonical-byte-vectors",
  "schemaVersion": "1.0.0",
  "vectors": [
    {
      "expected": "MATCH",
      "id": "CB-001",
      "json": "{\"TransactionId\":\"d4a2f9c1-3b5e-4f6a-9c7d-2e8f1a0b3c4d\",\"PayloadKind\":\"351cd60b-3fdf-48d4-b608-e93c0100f7d0\",\"TransactionTimeStamp\":\"2026-08-01T12:34:56.789Z\",\"Payload\":{\"IdentityAlias\":\"public-test-alias-001\",\"PublicSigningAddress\":\"0237fdd4364c0b898908be2f1a98a6b4a7890c623ae92a283640e44d87e048daa5\",\"PublicEncryptAddress\":\"032ebaf076203f15ac8119cfdbc9394d1c7b9929b0647e4f607e27da95701f8556\",\"IsPublic\":true},\"PayloadSize\":241}",
      "operation": "SERIALIZE",
      "payloadSize": 241,
      "utf8Hex": "7b225472616e73616374696f6e4964223a2264346132663963312d336235652d346636612d396337642d326538663161306233633464222c225061796c6f61644b696e64223a2233353163643630622d336664662d343864342d623630382d653933633031303066376430222c225472616e73616374696f6e54696d655374616d70223a22323032362d30382d30315431323a33343a35362e3738395a222c225061796c6f6164223a7b224964656e74697479416c696173223a227075626c69632d746573742d616c6961732d303031222c225075626c69635369676e696e6741646472657373223a22303233376664643433363463306238393839303862653266316139386136623461373839306336323361653932613238333634306534346438376530343864616135222c225075626c6963456e637279707441646472657373223a22303332656261663037363230336631356163383131396366646263393339346431633762393932396230363437653466363037653237646139353730316638353536222c2249735075626c6963223a747275657d2c225061796c6f616453697a65223a3234317d",
      "utf8Length": 429
    },
    {
      "expected": "DIFFERENT",
      "id": "CB-002",
      "json": "{\"TransactionId\":\"d4a2f9c1-3b5e-4f6a-9c7d-2e8f1a0b3c4d\",\"PayloadKind\":\"351cd60b-3fdf-48d4-b608-e93c0100f7d0\",\"TransactionTimeStamp\":\"2026-08-01T12:34:56.789Z\",\"Payload\":{\"IsPublic\":true,\"IdentityAlias\":\"public-test-alias-001\",\"PublicSigningAddress\":\"0237fdd4364c0b898908be2f1a98a6b4a7890c623ae92a283640e44d87e048daa5\",\"PublicEncryptAddress\":\"032ebaf076203f15ac8119cfdbc9394d1c7b9929b0647e4f607e27da95701f8556\"},\"PayloadSize\":241}",
      "mutation": "REORDER_PAYLOAD_FIELDS",
      "operation": "TAMPER",
      "utf8Hex": "7b225472616e73616374696f6e4964223a2264346132663963312d336235652d346636612d396337642d326538663161306233633464222c225061796c6f61644b696e64223a2233353163643630622d336664662d343864342d623630382d653933633031303066376430222c225472616e73616374696f6e54696d655374616d70223a22323032362d30382d30315431323a33343a35362e3738395a222c225061796c6f6164223a7b2249735075626c6963223a747275652c224964656e74697479416c696173223a227075626c69632d746573742d616c6961732d303031222c225075626c69635369676e696e6741646472657373223a22303233376664643433363463306238393839303862653266316139386136623461373839306336323361653932613238333634306534346438376530343864616135222c225075626c6963456e637279707441646472657373223a22303332656261663037363230336631356163383131396366646263393339346431633762393932396230363437653466363037653237646139353730316638353536227d2c225061796c6f616453697a65223a3234317d",
      "utf8Length": 429
    },
    {
      "expected": "DIFFERENT",
      "id": "CB-003",
      "json": "{\"TransactionId\":\"d4a2f9c1-3b5e-4f6a-9c7d-2e8f1a0b3c4d\",\"PayloadKind\":\"351cd60b-3fdf-48d4-b608-e93c0100f7d0\",\"TransactionTimeStamp\":\"2026-08-01T12:34:56.790Z\",\"Payload\":{\"IdentityAlias\":\"public-test-alias-001\",\"PublicSigningAddress\":\"0237fdd4364c0b898908be2f1a98a6b4a7890c623ae92a283640e44d87e048daa5\",\"PublicEncryptAddress\":\"032ebaf076203f15ac8119cfdbc9394d1c7b9929b0647e4f607e27da95701f8556\",\"IsPublic\":true},\"PayloadSize\":241}",
      "mutation": "CHANGE_TIMESTAMP_MS",
      "operation": "TAMPER",
      "utf8Hex": "7b225472616e73616374696f6e4964223a2264346132663963312d336235652d346636612d396337642d326538663161306233633464222c225061796c6f61644b696e64223a2233353163643630622d336664662d343864342d623630382d653933633031303066376430222c225472616e73616374696f6e54696d655374616d70223a22323032362d30382d30315431323a33343a35362e3739305a222c225061796c6f6164223a7b224964656e74697479416c696173223a227075626c69632d746573742d616c6961732d303031222c225075626c69635369676e696e6741646472657373223a22303233376664643433363463306238393839303862653266316139386136623461373839306336323361653932613238333634306534346438376530343864616135222c225075626c6963456e637279707441646472657373223a22303332656261663037363230336631356163383131396366646263393339346431633762393932396230363437653466363037653237646139353730316638353536222c2249735075626c6963223a747275657d2c225061796c6f616453697a65223a3234317d",
      "utf8Length": 429
    },
    {
      "expected": "DIFFERENT",
      "id": "CB-004",
      "json": "{\"TransactionId\":\"d4a2f9c1-3b5e-4f6a-9c7d-2e8f1a0b3c4d\",\"PayloadKind\":\"351cd60b-3fdf-48d4-b608-e93c0100f7d0\",\"TransactionTimeStamp\":\"2026-08-01T12:34:56.789Z\",\"Payload\":{\"IdentityAlias\":\"public-test-alias-001\",\"PublicSigningAddress\":\"0237fdd4364c0b898908be2f1a98a6b4a7890c623ae92a283640e44d87e048daa5\",\"PublicEncryptAddress\":\"032ebaf076203f15ac8119cfdbc9394d1c7b9929b0647e4f607e27da95701f8556\",\"IsPublic\":true},\"PayloadSize\":242}",
      "mutation": "CHANGE_PAYLOAD_SIZE",
      "operation": "TAMPER",
      "utf8Hex": "7b225472616e73616374696f6e4964223a2264346132663963312d336235652d346636612d396337642d326538663161306233633464222c225061796c6f61644b696e64223a2233353163643630622d336664662d343864342d623630382d653933633031303066376430222c225472616e73616374696f6e54696d655374616d70223a22323032362d30382d30315431323a33343a35362e3738395a222c225061796c6f6164223a7b224964656e74697479416c696173223a227075626c69632d746573742d616c6961732d303031222c225075626c69635369676e696e6741646472657373223a22303233376664643433363463306238393839303862653266316139386136623461373839306336323361653932613238333634306534346438376530343864616135222c225075626c6963456e637279707441646472657373223a22303332656261663037363230336631356163383131396366646263393339346431633762393932396230363437653466363037653237646139353730316638353536222c2249735075626c6963223a747275657d2c225061796c6f616453697a65223a3234327d",
      "utf8Length": 429
    },
    {
      "expected": "DIFFERENT",
      "id": "CB-005",
      "json": "{\"TransactionId\":\"d4a2f9c1-3b5e-4f6a-9c7d-2e8f1a0b3c4e\",\"PayloadKind\":\"351cd60b-3fdf-48d4-b608-e93c0100f7d0\",\"TransactionTimeStamp\":\"2026-08-01T12:34:56.789Z\",\"Payload\":{\"IdentityAlias\":\"public-test-alias-001\",\"PublicSigningAddress\":\"0237fdd4364c0b898908be2f1a98a6b4a7890c623ae92a283640e44d87e048daa5\",\"PublicEncryptAddress\":\"032ebaf076203f15ac8119cfdbc9394d1c7b9929b0647e4f607e27da95701f8556\",\"IsPublic\":true},\"PayloadSize\":241}",
      "mutation": "CHANGE_TRANSACTION_ID",
      "operation": "TAMPER",
      "utf8Hex": "7b225472616e73616374696f6e4964223a2264346132663963312d336235652d346636612d396337642d326538663161306233633465222c225061796c6f61644b696e64223a2233353163643630622d336664662d343864342d623630382d653933633031303066376430222c225472616e73616374696f6e54696d655374616d70223a22323032362d30382d30315431323a33343a35362e3738395a222c225061796c6f6164223a7b224964656e74697479416c696173223a227075626c69632d746573742d616c6961732d303031222c225075626c69635369676e696e6741646472657373223a22303233376664643433363463306238393839303862653266316139386136623461373839306336323361653932613238333634306534346438376530343864616135222c225075626c6963456e637279707441646472657373223a22303332656261663037363230336631356163383131396366646263393339346431633762393932396230363437653466363037653237646139353730316638353536222c2249735075626c6963223a747275657d2c225061796c6f616453697a65223a3234317d",
      "utf8Length": 429
    },
    {
      "expected": "DIFFERENT",
      "id": "CB-006",
      "json": "{\"TransactionId\":\"d4a2f9c1-3b5e-4f6a-9c7d-2e8f1a0b3c4d\",\"PayloadKind\":\"a7e3c4b2-1f8d-4e5a-9c6b-2d3e4f5a6b7c\",\"TransactionTimeStamp\":\"2026-08-01T12:34:56.789Z\",\"Payload\":{\"IdentityAlias\":\"public-test-alias-001\",\"PublicSigningAddress\":\"0237fdd4364c0b898908be2f1a98a6b4a7890c623ae92a283640e44d87e048daa5\",\"PublicEncryptAddress\":\"032ebaf076203f15ac8119cfdbc9394d1c7b9929b0647e4f607e27da95701f8556\",\"IsPublic\":true},\"PayloadSize\":241}",
      "mutation": "CHANGE_PAYLOAD_KIND",
      "operation": "TAMPER",
      "utf8Hex": "7b225472616e73616374696f6e4964223a2264346132663963312d336235652d346636612d396337642d326538663161306233633464222c225061796c6f61644b696e64223a2261376533633462322d316638642d346535612d396336622d326433653466356136623763222c225472616e73616374696f6e54696d655374616d70223a22323032362d30382d30315431323a33343a35362e3738395a222c225061796c6f6164223a7b224964656e74697479416c696173223a227075626c69632d746573742d616c6961732d303031222c225075626c69635369676e696e6741646472657373223a22303233376664643433363463306238393839303862653266316139386136623461373839306336323361653932613238333634306534346438376530343864616135222c225075626c6963456e637279707441646472657373223a22303332656261663037363230336631356163383131396366646263393339346431633762393932396230363437653466363037653237646139353730316638353536222c2249735075626c6963223a747275657d2c225061796c6f616453697a65223a3234317d",
      "utf8Length": 429
    },
    {
      "expected": "DIFFERENT",
      "id": "CB-007",
      "json": "{\"TransactionId\":\"d4a2f9c1-3b5e-4f6a-9c7d-2e8f1a0b3c4d\",\"PayloadKind\":\"351cd60b-3fdf-48d4-b608-e93c0100f7d0\",\"TransactionTimeStamp\":\"2026-08-01T12:34:56.789Z\",\"Payload\":{\"IdentityAlias\":\"public-test-alias-002\",\"PublicSigningAddress\":\"0237fdd4364c0b898908be2f1a98a6b4a7890c623ae92a283640e44d87e048daa5\",\"PublicEncryptAddress\":\"032ebaf076203f15ac8119cfdbc9394d1c7b9929b0647e4f607e27da95701f8556\",\"IsPublic\":true},\"PayloadSize\":241}",
      "mutation": "CHANGE_ALIAS_VALUE",
      "operation": "TAMPER",